{
  "schemaVersion": 1,
  "updated": "2026-10-18",
  "targets": {
    "calLo": 2800,
    "calHi": 3200,
    "pLo": 180,
    "pHi": 220
  },
  "days": [
    "Mon",
    "Tue",
    "Wed",
    "Thu",
    "Fri",
    "Sat",
    "Sun"
  ],
  "catalog": {
    "klime": {
      "brand": "Kevin's Natural Foods",
      "nm": "Cilantro Lime Chicken",
      "note": "Fully cooked · GF + DF · certified GF (GFCO) · paleo/keto certified · verified active Oct 18 2026 at Costco/Pavilions/Walmart/Kevin's site",
      "q": "Kevins Natural Foods Cilantro Lime Chicken"
    },
    "ksich": {
      "brand": "Kevin's Natural Foods",
      "nm": "Sichuan Chicken Green Bean Stir-Fry",
      "note": "GF + DF · soy-free sichuan sauce · coconut aminos · ~7 min · verified active Oct 18 2026 at Costco (updated Oct 16 2026)/Kevin's site/Gerbes — Instacart data tag incorrect, Kevin's site & Costco tracker confirm GF+DF",
      "q": "Kevins Natural Foods Sichuan Chicken Green Bean Stir Fry"
    },
    "klemon": {
      "brand": "Kevin's Natural Foods",
      "nm": "Lemongrass Chicken",
      "note": "GF + DF · coconut-milk sauce · no refined sugar · certified GF (GFCO) · verified active Oct 18 2026 at Amazon/Thrive Market/Instacart/Kevin's site",
      "q": "Kevins Natural Foods Lemongrass Chicken"
    },
    "kkorean": {
      "brand": "Kevin's Natural Foods",
      "nm": "Korean-Style BBQ Chicken",
      "note": "GF + DF · soy-free bulgogi sauce · coconut aminos · certified GF (GFCO) · verified active Oct 18 2026 at Kroger/Target/Whole Foods/Kevin's site",
      "q": "Kevins Natural Foods Korean BBQ Chicken"
    },
    "kroast": {
      "brand": "Kevin's Natural Foods",
      "nm": "Roasted Garlic Chicken",
      "note": "GF + DF · coconut-milk cream sauce · certified GF (GFCO) · high protein · no gluten/dairy/soy ingredients confirmed · verified active Oct 18 2026 at Safeway/Target/Lunds & Byerlys/Kevin's site",
      "q": "Kevins Natural Foods Roasted Garlic Chicken"
    },
    "kbeef": {
      "brand": "Kevin's Natural Foods",
      "nm": "Mongolian-Style Beef",
      "note": "GF + DF · certified GF (GFCO) · soy-free · grass-fed beef · coconut aminos sauce · verified active Oct 18 2026 at Kroger/Safeway/Sprouts/Whole Foods/Amazon",
      "q": "Kevins Natural Foods Mongolian Beef"
    },
    "kthai": {
      "brand": "Kevin's Natural Foods",
      "nm": "Thai-Style Coconut Chicken",
      "note": "GF + DF · coconut-milk curry · certified GF (GFCO) · paleo certified · no gluten/dairy/soy ingredients confirmed · verified active Oct 18 2026 at Target/Lunds & Byerlys/Kevin's site",
      "q": "Kevins Natural Foods Thai Style Coconut Chicken"
    },
    "ktikka": {
      "brand": "Kevin's Natural Foods",
      "nm": "Chicken Tikka Masala",
      "note": "GF + DF · coconut-milk tomato sauce · coconut butter (no ghee/dairy) · listed under Kevin's GF entrée collection · confirmed GF+DF on Kevin's site/Thrive Market · verified active Oct 18 2026",
      "q": "Kevins Natural Foods Chicken Tikka Masala"
    },
    "kteriyaki": {
      "brand": "Kevin's Natural Foods",
      "nm": "Teriyaki-Style Chicken",
      "note": "GF + DF · soy-free teriyaki · coconut aminos · certified GF · verified active Oct 18 2026 at Kroger/Target/Kevin's site",
      "q": "Kevins Natural Foods Teriyaki Style Chicken"
    },
    "khoney": {
      "brand": "Kevin's Natural Foods",
      "nm": "Honey Garlic Chicken with Green Beans",
      "note": "GF + DF · soy-free honey garlic sauce · coconut aminos · certified GF · dairy-free icon confirmed on Kevin's site · verified active Oct 18 2026 at Walmart/Kroger/Kevin's site",
      "q": "Kevins Natural Foods Honey Garlic Chicken Green Beans"
    },
    "amychili": {
      "brand": "Amy's",
      "nm": "Organic Black Bean Chili",
      "note": "GF + DF · vegan · certified organic · confirmed GF+DF on Amy's site & Kroger/Walmart · verified active Oct 18 2026",
      "q": "Amys Organic Black Bean Chili gluten free dairy free"
    },
    "amythai": {
      "brand": "Amy's",
      "nm": "Thai Red Curry Bowl",
      "note": "GF + DF · coconut-milk curry · jasmine rice · vegan · confirmed GF+DF on Amy's site/Kroger/Hannaford/H-E-B · verified active Oct 18 2026",
      "q": "Amys Thai Red Curry gluten free dairy free"
    },
    "rx": {
      "brand": "RXBAR",
      "nm": "Protein Bar",
      "note": "GF + DF · ~12g protein · made from egg whites, dates, nuts · verified active Oct 18 2026",
      "q": "RXBAR",
      "cal": 210,
      "p": 12,
      "c": 24,
      "f": 9,
      "planDesc": "any flavor"
    },
    "chomps": {
      "brand": "Chomps",
      "nm": "Meat Sticks",
      "note": "GF + DF · no fillers · high protein · verified active Oct 18 2026",
      "q": "Chomps meat sticks",
      "cal": 200,
      "p": 18,
      "c": 1,
      "f": 14,
      "planDesc": "2 sticks, beef or turkey"
    },
    "bada": {
      "brand": "Bada Bean Bada Boom",
      "nm": "Roasted Broad Beans",
      "note": "GF + DF · crunchy plant protein · vegan · verified active Oct 18 2026 at Amazon/Sprouts/Whole Foods/direct site",
      "q": "Bada Bean Bada Boom broad beans",
      "cal": 200,
      "p": 12,
      "c": 24,
      "f": 6,
      "planDesc": "1 bag"
    },
    "trail": {
      "brand": "",
      "nm": "Trail Mix (GF/DF)",
      "note": "GF + DF · whole-food fats + carbs",
      "q": "trail mix nuts dried fruit",
      "cal": 250,
      "p": 7,
      "c": 18,
      "f": 18,
      "planDesc": "¼ cup nuts + dried fruit"
    },
    "go": {
      "brand": "GoMacro",
      "nm": "MacroBar",
      "note": "GF + DF · certified organic · certified vegan · certified GF · plant protein · verified active Oct 18 2026 at gomacro.com",
      "q": "GoMacro MacroBar"
    },
    "partake": {
      "brand": "Partake Foods",
      "nm": "Soft Baked Cookies",
      "note": "Certified GF + DF · allergen-free · free from top 9 allergens · dedicated GF facility · verified active Oct 18 2026 at Target/Whole Foods/Amazon",
      "q": "Partake Foods soft baked cookies gluten free dairy free"
    },
    "thegfb": {
      "brand": "The GFB",
      "nm": "Protein Bites",
      "note": "Certified GF + DF · allergen-friendly · ~7g protein per serving · chocolate varieties · verified active Oct 18 2026 at Whole Foods/Amazon",
      "q": "The GFB protein bites gluten free dairy free"
    },
    "skinny": {
      "brand": "SkinnyPop",
      "nm": "Popcorn",
      "note": "GF + DF · non-GMO · simple ingredients · verified active Oct 18 2026",
      "q": "SkinnyPop popcorn"
    },
    "lara": {
      "brand": "LÄRABAR",
      "nm": "Fruit & Nut Bar",
      "note": "GF + DF · whole-food · minimal ingredients · verified active Oct 18 2026",
      "q": "Larabar"
    },
    "thats": {
      "brand": "That's It",
      "nm": "Fruit Bars",
      "note": "GF + DF · 2 ingredients only · verified active Oct 18 2026",
      "q": "Thats It fruit bars"
    },
    "marys": {
      "brand": "Mary's Gone Crackers",
      "nm": "Seed Crackers",
      "note": "GF + DF · certified GF · organic seeds · verified active Oct 18 2026",
      "q": "Marys Gone Crackers"
    },
    "hippeas": {
      "brand": "Hippeas",
      "nm": "Chickpea Puffs",
      "note": "GF + DF · plant-based · vegan certified · verified active Oct 18 2026",
      "q": "Hippeas chickpea puffs"
    },
    "jerky": {
      "brand": "Country Archer",
      "nm": "Beef Jerky",
      "note": "GF + DF · no MSG · high protein · verified active Oct 18 2026",
      "q": "Country Archer beef jerky"
    },
    "biena": {
      "brand": "Biena",
      "nm": "Roasted Chickpea Snacks",
      "note": "GF + DF · allergen-friendly · high fiber · verified active Oct 18 2026 at Costco/Amazon/direct site",
      "q": "Biena roasted chickpeas"
    },
    "madegood": {
      "brand": "MadeGood",
      "nm": "Granola Minis",
      "note": "GF + DF · allergen-friendly · made in dedicated facility · Granola Minis/Granola Bites line confirmed active Oct 18 2026 (only Crunchy Cookies, Crackers, and select Granola Bars discontinued Jun 2026 — Granola Minis unaffected)",
      "q": "MadeGood granola minis"
    },
    "simple": {
      "brand": "Simple Mills",
      "nm": "Almond Flour Crackers",
      "note": "GF · most flavors DF — verify flavor label · verified active Oct 18 2026",
      "q": "Simple Mills almond flour crackers"
    },
    "dang": {
      "brand": "Dang",
      "nm": "Coconut Chips",
      "note": "GF + DF · minimal ingredients · toasted coconut · verified active Oct 18 2026",
      "q": "Dang coconut chips"
    }
  },
  "meals": {
    "bOatsON": {
      "slot": "Breakfast",
      "nm": "Overnight Protein Oats",
      "appliance": "No-cook",
      "active": 3,
      "desc": "GF oats · 2 scoops protein · coconut milk · chia — soaked overnight, grab in AM",
      "cal": 700,
      "p": 55,
      "c": 88,
      "f": 16
    },
    "bSmoothie": {
      "slot": "Breakfast",
      "nm": "Power Smoothie",
      "appliance": "Blender",
      "active": 4,
      "desc": "frozen fruit · coconut milk · 2 scoops protein · ½ cup GF oats · almond butter",
      "cal": 720,
      "p": 62,
      "c": 70,
      "f": 20
    },
    "bEggsBatch": {
      "slot": "Breakfast",
      "nm": "Batch Eggs + Shake",
      "appliance": "No-cook",
      "active": 3,
      "desc": "3 pre-boiled eggs · protein shake · banana · 1 tbsp almond butter",
      "cal": 620,
      "p": 52,
      "c": 52,
      "f": 22
    },
    "lEntree": {
      "slot": "Lunch",
      "nm": "Reheat Entrée + Rice",
      "appliance": "Microwave",
      "active": 3,
      "desc": "Kevin's GF-DF entrée · batched rice · bagged greens",
      "cal": 620,
      "p": 46,
      "c": 72,
      "f": 14
    },
    "lChicken": {
      "slot": "Lunch",
      "nm": "Batch Chicken Rice Bowl",
      "appliance": "Assemble",
      "active": 4,
      "desc": "shredded crockpot chicken · batched rice · veg · coconut aminos",
      "cal": 680,
      "p": 52,
      "c": 70,
      "f": 14
    },
    "lChili": {